{"artifact_metadata":{"classification":"SYNTHETIC_FIXTURE","evidence_claim":"NOT_EVIDENCE_OR_PASS","fixture_notice":"SYNTHETIC EXAMPLE ONLY; NOT EVIDENCE; NOT A PASS VERDICT"},"binding_context_ref":{"artifact_path":"contracts/fixtures/governance-models/valid/binding-context-v2-m5.json","artifact_sha256":"763f34fcb78fae4d4de0473fe500220e7bec310d5f61799f7a44f378c27747e3","context_id":"fixture-binding-context-v2-m5"},"binding_id":"fixture-stage-evidence-binding-v2-m5-pre-canary","created_at":"2026-06-01T12:21:00Z","evidence_records":[{"action_instance_id":"fixture-action-stage-evidence-m5-pre-canary","actor_deployment_record_sha256":null,"artifact_path":"contracts/fixtures/governance-models/support/stage-evidence-record-v2-m5-pre-canary.json","artifact_sha256":"1ec214a134adcbbd9e7699ca0398c305939b3d78e2b931fade6457cf1b883769","evidence_id":"fixture-stage-evidence-v2-m5-pre-canary","evidence_record_kind":"run-evidence","execution_authorization_evaluation_ref":{"artifact_id":"fixture-execution-evaluation-stage-evidence-m5-pre-canary-pass","artifact_path":"contracts/fixtures/governance-models/valid/execution-authorization-evaluation-stage-evidence-m5-pre-canary-pass.json","artifact_sha256":"216636d73616878ee5dfd5f0c930d30d21e61a2b21c56a96879a90d38bc303f9","schema":"ylx.execution-authorization-evaluation.v1"},"execution_context_ids":["fixture-execution-context-source"],"planned_action_input_sha256":"81feb8e72905fce068937b63dcd5d4b698a4ec84ccc62b3875e5d3d94caafe12"}],"execution_context_refs":[{"artifact_path":"contracts/fixtures/governance-models/valid/execution-context.json","artifact_sha256":"ea9e327bcd84f8a20f333013e3eec83c4b02859e029e3264b35f0a310db00061","context_id":"fixture-execution-context-source"}],"required_execution_context_ids":["fixture-execution-context-source"],"reverse_coverage":[{"evidence_ids":["fixture-stage-evidence-v2-m5-pre-canary"],"execution_context_id":"fixture-execution-context-source","requirement_id":"BUILD-DEPLOY-01"},{"evidence_ids":["fixture-stage-evidence-v2-m5-pre-canary"],"execution_context_id":"fixture-execution-context-source","requirement_id":"BUILD-PROV-02"},{"evidence_ids":["fixture-stage-evidence-v2-m5-pre-canary"],"execution_context_id":"fixture-execution-context-source","requirement_id":"BUILD-RELEASE-01"},{"evidence_ids":["fixture-stage-evidence-v2-m5-pre-canary"],"execution_context_id":"fixture-execution-context-source","requirement_id":"CONSOLE-CORE-01"},{"evidence_ids":["fixture-stage-evidence-v2-m5-pre-canary"],"execution_context_id":"fixture-execution-context-source","requirement_id":"CONSOLE-STORE-01"},{"evidence_ids":["fixture-stage-evidence-v2-m5-pre-canary"],"execution_context_id":"fixture-execution-context-source","requirement_id":"E2E-FAKE-01"},{"evidence_ids":["fixture-stage-evidence-v2-m5-pre-canary"],"execution_context_id":"fixture-execution-context-source","requirement_id":"E2E-LEGACY-01"},{"evidence_ids":["fixture-stage-evidence-v2-m5-pre-canary"],"execution_context_id":"fixture-execution-context-source","requirement_id":"E2E-ROUTE-MEDIA-GUI-01"},{"evidence_ids":["fixture-stage-evidence-v2-m5-pre-canary"],"execution_context_id":"fixture-execution-context-source","requirement_id":"E2E-ROUTE-MEDIA-SCRIPT-01"},{"evidence_ids":["fixture-stage-evidence-v2-m5-pre-canary"],"execution_context_id":"fixture-execution-context-source","requirement_id":"E2E-V5-01"},{"evidence_ids":["fixture-stage-evidence-v2-m5-pre-canary"],"execution_context_id":"fixture-execution-context-source","requirement_id":"E2E-V5-02"},{"evidence_ids":["fixture-stage-evidence-v2-m5-pre-canary"],"execution_context_id":"fixture-execution-context-source","requirement_id":"E2E-V5-CORRECT-01"},{"evidence_ids":["fixture-stage-evidence-v2-m5-pre-canary"],"execution_context_id":"fixture-execution-context-source","requirement_id":"E2E-V5-OUTPUT-01"},{"evidence_ids":["fixture-stage-evidence-v2-m5-pre-canary"],"execution_context_id":"fixture-execution-context-source","requirement_id":"M0-MEAS-09"},{"evidence_ids":["fixture-stage-evidence-v2-m5-pre-canary"],"execution_context_id":"fixture-execution-context-source","requirement_id":"M0-MEAS-11"},{"evidence_ids":["fixture-stage-evidence-v2-m5-pre-canary"],"execution_context_id":"fixture-execution-context-source","requirement_id":"OLD-DATA-01"},{"evidence_ids":["fixture-stage-evidence-v2-m5-pre-canary"],"execution_context_id":"fixture-execution-context-source","requirement_id":"ROLLBACK-01"},{"evidence_ids":["fixture-stage-evidence-v2-m5-pre-canary"],"execution_context_id":"fixture-execution-context-source","requirement_id":"ROLLBACK-DATA-01"},{"evidence_ids":["fixture-stage-evidence-v2-m5-pre-canary"],"execution_context_id":"fixture-execution-context-source","requirement_id":"ROLLBACK-INFLIGHT-01"},{"evidence_ids":["fixture-stage-evidence-v2-m5-pre-canary"],"execution_context_id":"fixture-execution-context-source","requirement_id":"STABILITY-01"},{"evidence_ids":["fixture-stage-evidence-v2-m5-pre-canary"],"execution_context_id":"fixture-execution-context-source","requirement_id":"STORE-CORS-01"},{"evidence_ids":["fixture-stage-evidence-v2-m5-pre-canary"],"execution_context_id":"fixture-execution-context-source","requirement_id":"STORE-FIRST-PUBLISH-01"},{"evidence_ids":["fixture-stage-evidence-v2-m5-pre-canary"],"execution_context_id":"fixture-execution-context-source","requirement_id":"STORE-IAM-01"},{"evidence_ids":["fixture-stage-evidence-v2-m5-pre-canary"],"execution_context_id":"fixture-execution-context-source","requirement_id":"STORE-LIFECYCLE-01"},{"evidence_ids":["fixture-stage-evidence-v2-m5-pre-canary"],"execution_context_id":"fixture-execution-context-source","requirement_id":"SUPPORT-01"},{"evidence_ids":["fixture-stage-evidence-v2-m5-pre-canary"],"execution_context_id":"fixture-execution-context-source","requirement_id":"UPGRADE-COLD-01"},{"evidence_ids":["fixture-stage-evidence-v2-m5-pre-canary"],"execution_context_id":"fixture-execution-context-source","requirement_id":"UPGRADE-N1-01"},{"evidence_ids":["fixture-stage-evidence-v2-m5-pre-canary"],"execution_context_id":"fixture-execution-context-source","requirement_id":"UPGRADE-POWER-01"},{"evidence_ids":["fixture-stage-evidence-v2-m5-pre-canary"],"execution_context_id":"fixture-execution-context-source","requirement_id":"WORKER-CONTRACT-01"},{"evidence_ids":["fixture-stage-evidence-v2-m5-pre-canary"],"execution_context_id":"fixture-execution-context-source","requirement_id":"WORKER-INPUT-01"},{"evidence_ids":["fixture-stage-evidence-v2-m5-pre-canary"],"execution_context_id":"fixture-execution-context-source","requirement_id":"WORKER-LIMIT-01"},{"evidence_ids":["fixture-stage-evidence-v2-m5-pre-canary"],"execution_context_id":"fixture-execution-context-source","requirement_id":"WORKER-RECOVER-01"}],"schema":"ylx.evidence-binding.v1"}