{"artifact_metadata":{"classification":"SYNTHETIC_FIXTURE","evidence_claim":"NOT_EVIDENCE_OR_PASS","fixture_notice":"SYNTHETIC EXAMPLE ONLY; NOT EVIDENCE; NOT A PASS VERDICT"},"binding_context_ref":{"artifact_path":"contracts/fixtures/governance-models/valid/binding-context-v2-m4-r2.json","artifact_sha256":"10e7b41328efd2c8afdde648151b29ca30921bb0694c7bc37df8c269249ecf65","context_id":"fixture-binding-context-v2-m4"},"binding_id":"fixture-stage-evidence-binding-v2-m4c","created_at":"2026-06-01T12:21:00Z","evidence_records":[{"action_instance_id":"fixture-action-stage-evidence-m4c","actor_deployment_record_sha256":null,"artifact_path":"contracts/fixtures/governance-models/support/stage-evidence-record-v2-m4c.json","artifact_sha256":"4320e0f8cf0e85cfe8cd2f14d923465ada96515f1b10d36f84dc955570fdda4c","evidence_id":"fixture-stage-evidence-v2-m4c","evidence_record_kind":"run-evidence","execution_authorization_evaluation_ref":{"artifact_id":"fixture-execution-evaluation-stage-evidence-m4c-pass","artifact_path":"contracts/fixtures/governance-models/valid/execution-authorization-evaluation-stage-evidence-m4c-pass.json","artifact_sha256":"3712821b37cd61285f6cbfafc85981f566bf8cbfed19ca162d410f292bd1e58d","schema":"ylx.execution-authorization-evaluation.v1"},"execution_context_ids":["fixture-execution-context-source"],"planned_action_input_sha256":"45c022486ec3b4b11224e2584a8e6e43366cda270ed34a46ceeba8c1487df720"}],"execution_context_refs":[{"artifact_path":"contracts/fixtures/governance-models/valid/execution-context.json","artifact_sha256":"ea9e327bcd84f8a20f333013e3eec83c4b02859e029e3264b35f0a310db00061","context_id":"fixture-execution-context-source"}],"required_execution_context_ids":["fixture-execution-context-source"],"reverse_coverage":[{"evidence_ids":["fixture-stage-evidence-v2-m4c"],"execution_context_id":"fixture-execution-context-source","requirement_id":"M0-MEAS-06"},{"evidence_ids":["fixture-stage-evidence-v2-m4c"],"execution_context_id":"fixture-execution-context-source","requirement_id":"PREVIEW-CONTENT-01"},{"evidence_ids":["fixture-stage-evidence-v2-m4c"],"execution_context_id":"fixture-execution-context-source","requirement_id":"PREVIEW-DROP-01"},{"evidence_ids":["fixture-stage-evidence-v2-m4c"],"execution_context_id":"fixture-execution-context-source","requirement_id":"PREVIEW-DROP-02"},{"evidence_ids":["fixture-stage-evidence-v2-m4c"],"execution_context_id":"fixture-execution-context-source","requirement_id":"PREVIEW-FALLBACK-01"},{"evidence_ids":["fixture-stage-evidence-v2-m4c"],"execution_context_id":"fixture-execution-context-source","requirement_id":"PREVIEW-ISOLATE-01"},{"evidence_ids":["fixture-stage-evidence-v2-m4c"],"execution_context_id":"fixture-execution-context-source","requirement_id":"PREVIEW-LAT-01"},{"evidence_ids":["fixture-stage-evidence-v2-m4c"],"execution_context_id":"fixture-execution-context-source","requirement_id":"PREVIEW-RATE-01"},{"evidence_ids":["fixture-stage-evidence-v2-m4c"],"execution_context_id":"fixture-execution-context-source","requirement_id":"PREVIEW-RES-01"},{"evidence_ids":["fixture-stage-evidence-v2-m4c"],"execution_context_id":"fixture-execution-context-source","requirement_id":"ROLLBACK-PREVIEW-01"}],"schema":"ylx.evidence-binding.v1"}