{"artifact_metadata":{"classification":"SYNTHETIC_FIXTURE","evidence_claim":"NOT_EVIDENCE_OR_PASS","fixture_notice":"SYNTHETIC EXAMPLE ONLY; NOT EVIDENCE; NOT A PASS VERDICT"},"binding_context_ref":{"artifact_path":"contracts/fixtures/governance-models/valid/binding-context-v2-m2.json","artifact_sha256":"ae17194abe180fc54bf8223ded255234fc6b554c43a3e56abb70db2b70317599","context_id":"fixture-binding-context-v2-m2-qualification"},"binding_id":"fixture-issue-verdict-evidence-binding-v2-m2","created_at":"2026-06-01T12:47:00Z","evidence_records":[{"action_instance_id":"fixture-action-issue-verdict-m2-pass","actor_deployment_record_sha256":null,"artifact_path":"contracts/fixtures/governance-models/valid/issue-register-gate-verdict-m2.json","artifact_sha256":"ee35e98c5ced528abd7171375db9ba7be2743a0fbffb463bc5a0e21757818faf","evidence_id":"fixture-issue-register-gate-verdict-m2","evidence_record_kind":"run-evidence","execution_authorization_evaluation_ref":{"artifact_id":"fixture-execution-evaluation-issue-verdict-m2-pass","artifact_path":"contracts/fixtures/governance-models/valid/execution-authorization-evaluation-issue-verdict-m2-pass.json","artifact_sha256":"6049501ea1f6e2f1c16c438f91d54bb75962d654a0b7c23991f74d38009cfb6b","schema":"ylx.execution-authorization-evaluation.v1"},"execution_context_ids":["fixture-execution-context-source"],"planned_action_input_sha256":"66e10855d88ca2f24d14a9b86fda050fef6e9bac97cc872383dad36ba9c9329a"}],"execution_context_refs":[{"artifact_path":"contracts/fixtures/governance-models/valid/execution-context.json","artifact_sha256":"ea9e327bcd84f8a20f333013e3eec83c4b02859e029e3264b35f0a310db00061","context_id":"fixture-execution-context-source"}],"required_execution_context_ids":["fixture-execution-context-source"],"reverse_coverage":[{"evidence_ids":["fixture-issue-register-gate-verdict-m2"],"execution_context_id":"fixture-execution-context-source","requirement_id":"M2-ISSUES-01"}],"schema":"ylx.evidence-binding.v1"}